{
  "publication_version": 1,
  "publisher": {
    "name": "EDIT: our project name once chosen",
    "contact": "EDIT: our contact email",
    "url": "EDIT: our site URL"
  },
  "subject": {
    "name": "EDIT: upstream project name",
    "repo_url": "EDIT: upstream repository URL",
    "license": "EDIT: upstream license identifier",
    "commit": "EDIT: stamped at deploy",
    "snapshot_date": "2026-01-01",
    "affiliation": "none"
  },
  "purpose": "demo",
  "update_policy": "snapshot",
  "header": {
    "banner": "Unofficial architecture map of {{subject.name}}, generated from public source at commit {{subject.commit}} ({{subject.snapshot_date}}). Not affiliated with or endorsed by the {{subject.name}} project or its maintainers.",
    "front_page": [
      "This demo is a point-in-time snapshot published to show what {{generated_by.tool}} produces on a real, well-known codebase. It may be refreshed from newer source periodically.",
      "It is not project documentation for {{subject.name}} and should not be treated as authoritative for the upstream project. For the real thing, go to the source: {{subject.repo_url}}."
    ]
  },
  "footer": {
    "always": [
      "Generated by {{generated_by.tool}} {{generated_by.version}} from public source at commit {{subject.commit}} ({{subject.snapshot_date}}).",
      "Unofficial demo, not affiliated with the {{subject.name}} project.",
      "Published by {{publisher.name}}. Maintainers of {{subject.name}}: if anything here concerns you, contact {{publisher.contact}} and we will respond before taking any further action."
    ],
    "front_page": [
      "Analyzed from public source under its license ({{subject.license}}). No source code is republished: this map contains structural facts, names, and AI-written descriptions.",
      "Published only after passing our validation gates. Coverage and known gaps are declared inside the viewer, never papered over."
    ]
  },
  "context": [
    "EDIT per demo: one or two sentences on why we chose this project and what is architecturally interesting about it. Written with respect. Every project in this showcase is one we admire."
  ],
  "disclaimers": [
    "Descriptions are generated with AI assistance and validated by sampling, not line-by-line human review. The validation results for this demo are published alongside it.",
    "This snapshot reflects the codebase at the pinned commit only. The upstream project may have changed since."
  ],
  "access": {
    "visibility": "public",
    "gate": null
  },
  "generated_by": {
    "tool": "solution-explorer",
    "version": "EDIT: stamped at deploy"
  }
}
