{
  "publication_version": 1,
  "publisher": {
    "name": "SysCorpus",
    "contact": "https://github.com/sirfifer/solution-explorer/issues",
    "url": "https://github.com/sirfifer/solution-explorer"
  },
  "subject": {
    "name": "Visual Studio Code",
    "repo_url": "https://github.com/microsoft/vscode",
    "license": "MIT",
    "commit": "474a349ad5b745e512ef86b864d1c74f7264dd7a",
    "snapshot_date": "2026-08-19",
    "affiliation": "none"
  },
  "purpose": "evaluation",
  "update_policy": "snapshot",
  "header": {
    "banner": "Private evaluation map of {{subject.name}}, generated from public source at commit {{subject.commit}} ({{subject.snapshot_date}}). Unofficial and not affiliated with or endorsed by Microsoft or the {{subject.name}} maintainers.",
    "front_page": [
      "This point-in-time map is a private review artifact for evaluating what {{generated_by.tool}} produces on a large, real codebase.",
      "It is not upstream documentation. Verify important conclusions against {{subject.repo_url}}."
    ]
  },
  "footer": {
    "always": [
      "Generated by {{generated_by.tool}} {{generated_by.version}} from public source at commit {{subject.commit}}.",
      "Unofficial private evaluation, not affiliated with Microsoft or the {{subject.name}} project.",
      "Questions or corrections: {{publisher.contact}}."
    ],
    "front_page": [
      "Analyzed from public source under the {{subject.license}} license. The upstream license and third-party notices travel with this review bundle.",
      "Interpretive descriptions are review aids; evidence links and declared gaps remain the source of trust."
    ]
  },
  "context": [
    "This private review exercises SysCorpus against the Visual Studio Code source snapshot before any publication decision."
  ],
  "disclaimers": [
    "Interpretive descriptions may include AI-assisted text and are not a substitute for upstream source or documentation.",
    "This snapshot reflects only the pinned commit; the upstream project may have changed."
  ],
  "access": {
    "visibility": "private-preview",
    "gate": "Local review now; any hosted preview must require reviewer authentication."
  },
  "generated_by": {
    "tool": "SysCorpus",
    "version": "1.2.0"
  }
}
