{
  "publication_version": 1,
  "publisher": {
    "name": "EDIT: your name or organization",
    "contact": "EDIT: email or issue tracker URL",
    "url": ""
  },
  "subject": {
    "name": "EDIT: project name",
    "homepage_url": "EDIT: public project website URL",
    "repo_url": "EDIT: repository URL",
    "license": "EDIT: license identifier, for example MIT",
    "commit": "EDIT: stamped at deploy",
    "snapshot_date": "2026-01-01",
    "affiliation": "owner"
  },
  "purpose": "documentation",
  "update_policy": "continuous",
  "header": {
    "banner": "Interactive architecture map of {{subject.name}}, generated from source at commit {{subject.commit}} ({{subject.snapshot_date}}).",
    "front_page": [
      "This map is generated automatically from the source code. Component descriptions may include AI-written text. Coverage and known gaps are reported inside the viewer, not hidden."
    ]
  },
  "footer": {
    "always": [
      "Generated by {{generated_by.tool}} {{generated_by.version}} from {{subject.name}} at commit {{subject.commit}}.",
      "Published by {{publisher.name}}. Contact: {{publisher.contact}}."
    ],
    "front_page": [
      "Source: {{subject.repo_url}} ({{subject.license}})."
    ]
  },
  "context": [],
  "disclaimers": [],
  "access": {
    "visibility": "public",
    "gate": null
  },
  "generated_by": {
    "tool": "solution-explorer",
    "version": "EDIT: stamped at deploy"
  }
}
